,url,text
0,https://katowice.naszemiasto.pl/pedzil-z-predkoscia-192-km-na-godzine-mandat-zwala-z-nog/ar/c1-8928759,"Policyjna grupa ""SPEED"" to jednostka, której zadaniem jest kontrola miejsc, w której najczęściej dochodzi do łamania przepisów ruchu drogowego. Funkcjonariusze tej grupy poruszają się nieoznakowanymi samochodami wyposażonymi w wideorejestratory. Zabrzańscy policjanci z tej właśnie grupy we wtorek wieczorem, 26 lipca, patrolowali drogę krajową nr 78 na trasie Katowice - Mysłowice, gdy zauważyli motocyklistę poruszającego się ze znaczną prędkością. W trakcie jazdy motocyklista nie stosował się do obowiązku korzystania z prawego pasa ruchu a także, wykonując niebezpieczne manewry, stworzył dodatkowo zagrożenie w ruchu drogowym. Pomiar prędkości wykazał, że 40-letni mieszkaniec Katowic poruszał się z prędkością 192 kilometrów na godzinę!
Podczas sprawdzenia danych mężczyzny i pojazdu w policyjnych systemach okazało się, że motocykl nie ma wymaganego badania technicznego. Ze względu na ten fakt policjanci zatrzymali dowód rejestracyjny.
Ostatecznie, fan łamania przepisów został ukarany mandatem w wysokości 13 tysięcy złotych, a na jego konto trafiło dodatkowe 28 punktów karnych. 

Dołącz do nas na Facebooku!
Publikujemy najciekawsze artykuły, wydarzenia i konkursy. Jesteśmy tam gdzie nasi czytelnicy!

Kontakt z redakcją
Byłeś świadkiem ważnego zdarzenia? Widziałeś coś interesującego? Zrobiłeś ciekawe zdjęcie lub wideo?
Żakardowy płaszcz w kwiaty
Sukienka z jedwabiem
Kaszmirowe joggersy
Kaszmirowe joggersy
Dopasowana marynarka z wełną
Marynarka z wiskozy
Parka z kapturem
Szyfonowa sukienka z jedwabiem
Materiał oryginalny: Pędził z prędkością 192 km na godzinę, mandat zwala z nóg - Zabrze Nasze Miasto

Rozpowszechnianie niniejszego artykułu możliwe jest tylko i wyłącznie zgodnie z postanowieniami
„Regulaminu korzystania z artykułów prasowych”i po
wcześniejszym uiszczeniu należności, zgodnie z cennikiem.

Nie hejtuj, pisz kulturalne i zgodne z prawem komentarze! Jeśli widzisz niestosowny wpis - kliknij „zgłoś nadużycie”.
Gdzie w województwie śląskim należy spodziewać się dzisiaj (31.05.2023) utrudnień? Roboty drogowe: droga S1g, Laliki (6. km na odc. 0,8 km) Na czas robót ruch...
Sprawdź, gdzie dokładnie mieści się posterunek, komisariat lub komenda policji w Katowicach. Tu dowiesz się, na czym polegają ich codzienne zadania. Sprawdzisz...
SPORT. 409 kibiców Ruchu Chorzów wspierało Niebieskich w meczu derbowym z GKS Katowice. Zobaczcie zdjęcia fanów gości w Śląskim Klasyku, rozegranym w sobotę 27...
W niedzielę 28 maja 2023 późnym popołudniem na 307 km autostrady A4 doszło do groźnie wyglądającej kolizji dwóch samochodów osobowych. Na miejscu pracują służby...
Przygotowaliśmy dla Ciebie tygodniową prasówkę. Jeśli w mijającym tygodniu byłeś zbyt zajęty, by nadążyć za informacjami z Katowic, zobacz teraz artykuły, które...
INWESTYCJE. Katowickie Towarzystwo Budownictwa Społecznego ogłosiło przetarg na budowę osiedla na Giszowcu przy ul. Kosmicznej. Powstanie tam 7 budynków, w...
Firmy w mieście
Aktualności
Wiadomości lokalne
Ogłoszenia
Serwisy regionalne
Serwisy partnerskie

Polska Press Sp. z o.o. informuje, że wszystkie treści ukazujące się w serwisie Nasze Miasto
podlegają ochronie.

Jesteś zainteresowany kupnem treści?
Dowiedz się więcej.


© 2000-2023 Polska Press Sp. z o.o.


Wybierz z listy lub przejdź na  

naszemiasto.pl

Nie znaleźliśmy serwisów odpowiadającym twojemu zapytaniu."
1,https://lubuskie.naszemiasto.pl/tragicznie-zakonczyla-sie-historia-mlodej-lubuszanki/ar/c16-8858637,"Przypomnijmy, że w czwartek, 14 kwietnia, w okolicach Słońska znaleziono ludzkie ciało. Policja nie udzielała wtedy żadnych informacji. Prokuratura również była oszczędna w wypowiedziach. 
Dziś, niemal 2 miesiące od tego zdarzenia wiadomo już, do kogo należało znalezione ciało. Niestety potwierdziły się najgorsze przypuszczenia. 
- Potwierdzam, że to ciało Klaudii Jarneckiej. Wciąż badamy okoliczności jej śmierci - przekazuje nam prokurator Łukasz Gospodarek, rzecznik prasowy Prokuratury Okręgowej w Gorzowie Wielkopolskim. 
Przypomnijmy, że poszukiwania Klaudii Jarneckiej trwały od 20 października 2021 roku. Po niepokojących wiadomościach do mamy ślad po niej się urwał. Dziewczyna zaginęła w tajemniczych okolicznościach. 
Klaudia noc z 20 na 21 października spędziła z wcześniej poznanym mężczyzną o imieniu Damian, których pochodzi z jej rodzinnej miejscowości – ze Słońska. 21 października dziewczyna jeszcze raz miała spotkać się ze znajomym. Wtedy była widziana właśnie w Słońsku i w Kostrzynie nad Odrą. Tego dnia połączyła się również ze swoją mamą na rozmowę wideo. Kilka chwil później Klaudia wysłała jej wtedy zdjęcie łąki, a do tego dołączyła dziwne wiadomości. 
""Nie zdążę już” – napisała do mamy. ,,Na co? Na zachód słońca?” – zapytała Beata Jarnecka. ""Słońce stało” – odpisała jej córka. Ostatnia wiadomość, jaką Klaudia wysłała do swojej mamy zawierała tylko jedno słowo (przekleństwo) – ""ku***!”. Dzieje się to o 17.56.
Od tego czasu Klaudii szukało całe województwo lubuskie, policja, detektywi, zrozpaczona mama. 

Dołącz do nas na Facebooku!
Publikujemy najciekawsze artykuły, wydarzenia i konkursy. Jesteśmy tam gdzie nasi czytelnicy!

Kontakt z redakcją
Byłeś świadkiem ważnego zdarzenia? Widziałeś coś interesującego? Zrobiłeś ciekawe zdjęcie lub wideo?
Odkryj jak Twój organizm, umysł i samopoczucie zmi...
Zastanawiasz się od czego zacząć zmianę sposobu od...
Gotowi na śmiały krok w kierunku zdrowia? Ten wari...
Prowadzisz aktywny tryb życia? Lubisz wyzwania? Po...
Chcesz dobrze wyglądać i czuć się świetnie? Profes...
Uprawiasz trening siłowy i chcesz zbudować ponadpr...
Trenujesz bieganie, pływasz, jeździsz na rowerze l...

Rozpowszechnianie niniejszego artykułu możliwe jest tylko i wyłącznie zgodnie z postanowieniami
„Regulaminu korzystania z artykułów prasowych”i po
wcześniejszym uiszczeniu należności, zgodnie z cennikiem.

Nie hejtuj, pisz kulturalne i zgodne z prawem komentarze! Jeśli widzisz niestosowny wpis - kliknij „zgłoś nadużycie”.
Pies na spacerze zaczął szczekać tak, że właściciel zawiadomił policję. Okazało się później, że miała to być zbrodnia doskonała. Z rozpuszczonych w żrącej...
Po ponad dobie od znalezienia dwóch ciał w aucie stojącym przy polnej drodze nadal nie wiemy, jak doszło do tragedii. Policja ujawnia niewiele szczegółów,...
Mieszkanka Sławy straciła swoje oszczędności po tym, jak zaufała oszustowi, który obiecał jej spory zysk na kryptowalutach. Ukradł z jej konta 44 tysiące...
Do przemocy najczęściej dochodzi za zamkniętymi drzwiami i bez świadków. Pokrzywdzeni w milczeniu znoszą swój los i niechętnie proszą o wsparcie. Teraz nadarza...
Ta sprawa rok temu zbulwersowała wielu mieszkańców. Dwaj policjanci zatrzymali nowosolanina i brutalnie go zaatakowali. Obaj zostali wydaleni ze służby....
Zielonogórska prokuratura, prowadząca dochodzenie w sprawie wybuchu paczki w Siecieborzycach w Lubuskiem, poinformowała, że postawiła zarzuty Błażejowi K. Sąd...
Firmy w mieście
Aktualności
Wiadomości lokalne
Ogłoszenia
Serwisy regionalne
Serwisy partnerskie

Polska Press Sp. z o.o. informuje, że wszystkie treści ukazujące się w serwisie Nasze Miasto
podlegają ochronie.

Jesteś zainteresowany kupnem treści?
Dowiedz się więcej.


© 2000-2023 Polska Press Sp. z o.o.


Wybierz z listy lub przejdź na  

naszemiasto.pl

Nie znaleźliśmy serwisów odpowiadającym twojemu zapytaniu."
2,https://lubelskie.naszemiasto.pl/lublin-rodzice-wyjechali-na-urlop-a-ich-16-letni-syn-wzial/ar/c1-8927903,"Do zdarzenia doszło w Lublinie w nocy ze środy na czwartek (27-28 lipca). Funkcjonariusze z Wydziału Ruchu Drogowego Komendy Miejskiej Policji w Lublinie zatrzymali do kontroli hondę civic ze względu na usterkę świateł.
Okazało się, że jej 16-letni kierowca nie miał uprawnień do kierowania pojazdu, który wziął pod nieobecność rodziców, przebywających na urlopie. Mało tego – przewoził 6 pasażerów, a licznik samochodu okazał się być cofnięty o ponad 100 tysięcy kilometrów.
Sprawą „kręconego” licznika zajmują się policjanci z 1. komisariatu, natomiast o dalszym losie 16-latka zadecyduje sąd rodzinny i nieletnich.

Dołącz do nas na Facebooku!
Publikujemy najciekawsze artykuły, wydarzenia i konkursy. Jesteśmy tam gdzie nasi czytelnicy!

Kontakt z redakcją
Byłeś świadkiem ważnego zdarzenia? Widziałeś coś interesującego? Zrobiłeś ciekawe zdjęcie lub wideo?
Żakardowy płaszcz w kwiaty
Sukienka z jedwabiem
Kaszmirowe joggersy
Kaszmirowe joggersy
Dopasowana marynarka z wełną
Marynarka z wiskozy
Parka z kapturem
Szyfonowa sukienka z jedwabiem
Materiał oryginalny: Lublin. Rodzice wyjechali na urlop, a ich 16-letni syn wziął ich samochód i 6 znajomych na przejażdżkę - Kurier Lubelski

Rozpowszechnianie niniejszego artykułu możliwe jest tylko i wyłącznie zgodnie z postanowieniami
„Regulaminu korzystania z artykułów prasowych”i po
wcześniejszym uiszczeniu należności, zgodnie z cennikiem.

Nie hejtuj, pisz kulturalne i zgodne z prawem komentarze! Jeśli widzisz niestosowny wpis - kliknij „zgłoś nadużycie”.
Tuchola ma dołączyć do kujawsko-pomorskich miast i miejscowości posiadających obwodnicę. - To informacja, na którą wszyscy czekamy w zasadzie od co najmniej...
Na widok radiowozu kierowcy i piesi szczególnie zwracają uwagę na przepisy ruchu drogowego. Co innego, kiedy funkcjonariuszy nie widać. Ale mandat można dostać...
Czy jesteście gotowi na ekscytującą przygodę na dwóch kółkach? Przygotujcie się na najbardziej niezapomniane zawody rowerowe dla dzieci! Już w sobotę, 17...
DK 28 w Kasienie Wielkiej została wyłączona z ruchu aż do odwołania. Winne jest osuwisko, które uaktywniło się niszcząc drogę i jej podbudowę. GDDKiA wyznaczyła...
To niemal jak sceny z filmu. Policjanci z pruszczańskiej drogówki ruszyli w pościg za motocyklistą, który nie zatrzymał się do kontroli drogowej, po tym jak...
Kilka dni przed terminem zakończono przebudowę ul. Kasztanowej w Starowej Górze. Obył się już odbiór techniczny.
Firmy w mieście
Aktualności
Wiadomości lokalne
Ogłoszenia
Serwisy regionalne
Serwisy partnerskie

Polska Press Sp. z o.o. informuje, że wszystkie treści ukazujące się w serwisie Nasze Miasto
podlegają ochronie.

Jesteś zainteresowany kupnem treści?
Dowiedz się więcej.


© 2000-2023 Polska Press Sp. z o.o.


Wybierz z listy lub przejdź na  

naszemiasto.pl

Nie znaleźliśmy serwisów odpowiadającym twojemu zapytaniu."
3,https://bielawa.naszemiasto.pl/jest-ich-tylko-dziesieciu-na-calym-dolnym-slasku-posiadaja/ar/c1-9184641,"Tych mężczyzn poszukuje dolnośląska policja za nielegalne posiadanie broni lub amunicji: 

Jest ich tylko dziesięciu, na całym Dolnym śląsku! Posiadaj...

Dane, w tym zdjęcia i rysopisy, pochodzą ze steony policja.gov i są aktualne na dzień 26.01.2023Jak stanowi art. 263 kk § 2 kk: kto bez wymaganego zezwolenia posiada broń palną lub amunicję, podlega karze pozbawienia wolności od 6 miesięcy do lat 8. We wskazanym artykule jasno jest przedstawione, że kara pozbawienia wolności od 6 miesięcy do lat 8 odnosi się wyłącznie do nielegalnego posiadania broni palnej lub amunicji do niej.
W rozumieniu ustawy o broni i amunicji (u.b.a.) a konkretnie art. 4 u. 1, pojęcie broni jest szersze od pojęcia broni palnej bowiem bronią jest nie tylko broń palna ale także i broń pneumatyczna (wiatrówka), miotacze gazu, broń biała, kusze, a także paralizatory.Zgodnie z przepisami wskazanej ustawy broń palna to każda przenośna broń lufowa, która miota, jest przeznaczona do miotania lub może być przystosowana do miotania jednego lub większej liczby pocisków lub substancji w wyniku działania materiału miotającego. Należy przez to rozumieć broń bojową, myśliwską, sportową, gazową, alarmową i sygnałową- czytamy na stronie infor.pl.

Dołącz do nas na Facebooku!
Publikujemy najciekawsze artykuły, wydarzenia i konkursy. Jesteśmy tam gdzie nasi czytelnicy!

Kontakt z redakcją
Byłeś świadkiem ważnego zdarzenia? Widziałeś coś interesującego? Zrobiłeś ciekawe zdjęcie lub wideo?
Żakardowy płaszcz w kwiaty
Sukienka z jedwabiem
Kaszmirowe joggersy
Kaszmirowe joggersy
Dopasowana marynarka z wełną
Marynarka z wiskozy
Parka z kapturem
Szyfonowa sukienka z jedwabiem
Materiał oryginalny:  Jest ich tylko dziesięciu, na całym Dolnym śląsku! Posiadają nielegalnie broń i mogą byś niebezpieczni!!! - Legnica Nasze Miasto

Rozpowszechnianie niniejszego artykułu możliwe jest tylko i wyłącznie zgodnie z postanowieniami
„Regulaminu korzystania z artykułów prasowych”i po
wcześniejszym uiszczeniu należności, zgodnie z cennikiem.

Nie hejtuj, pisz kulturalne i zgodne z prawem komentarze! Jeśli widzisz niestosowny wpis - kliknij „zgłoś nadużycie”.
Bez litości znęcali się nad osobami najbliższymi, a teraz ukrywają się przed policją i prokuraturą. Wszyscy pochodzą z Dolnego Śląska. Publikujemy zdjęcia i...
W środę o godzinie 15:30 dwóch mężczyzn napadło na Biedronkę w Legnicy. Mieli przy sobie przedmiot przypominający broń, którym celowali do ochroniarza. Po...
Tych mężczyzn poszukuje dolnośląska policja za udział w bójkach i pobiciach. Niektórzy użyli do tego broni palnej lub innych niebezpiecznych narzędzi. Zdjęcia...
Ci mężczyźni są podejrzani lub oskarżeni o pedofilię. Mogą ukrywać się wszędzie, więc jeśli znasz miejsce pobytu któregoś z nich, zadzwoń na policję. Oni już...
Oto najniebezpieczniejsi przestępcy w Europie poszukiwani przez Europol. Wielu z nich to mordercy, są wśród nich handlarze ludźmi, którzy nie mieli skrupułów...
Prokuratura Okręgowa w Legnicy potwierdziła, że ksiądz Grzegorz O., dyrektor Salezjańskiej Szkoły Podstawowej w Lubinie usłyszał zarzuty posiadania treści...
Firmy w mieście
Aktualności
Wiadomości lokalne
Ogłoszenia
Serwisy regionalne
Serwisy partnerskie

Polska Press Sp. z o.o. informuje, że wszystkie treści ukazujące się w serwisie Nasze Miasto
podlegają ochronie.

Jesteś zainteresowany kupnem treści?
Dowiedz się więcej.


© 2000-2023 Polska Press Sp. z o.o.


Wybierz z listy lub przejdź na  

naszemiasto.pl

Nie znaleźliśmy serwisów odpowiadającym twojemu zapytaniu."
4,https://bielawa.naszemiasto.pl/zastepca-komendanta-policji-w-walbrzychu-odwolany-w/ar/c1-9125851,"Spis treści
Dzisiaj oficjalnie do sprawy odniosła się Komenda Miejska Policji w Wałbrzychu. Jak mówi Marcin Świeży, rzecznik komendanta odwołanie ma związek m.in. z tym, że członek rodziny Arkadiusza Wojnowskiego brał udział w zdarzeniu o charakterze kryminalnym na terenie miasta.
 - I zależy nam na tym, aby nikt nie miał uwag co do bezstronności w prowadzeniu tego postępowania. Mogę dodać, że funkcjonariusz posiada pełne prawa emerytalne i postanowił złożyć stosowny raport oraz przejść w stan spoczynku - zaznacza Marcin Świeży. 
Jak dodaje, policja wyjaśnia wszystkie okoliczności zdarzenia pod klubem na Piaskowej Górze w Wałbrzychu, gdzie doszło do bójki między grupą osób. Zdarzenie zarejestrowały kamery ITS-u i policja zabezpieczyła film.
- Ustalamy, kto i w jakim zakresie uczestniczył w tym zajściu i kto będzie miał zarzuty. Postępowanie prowadzone jest pod nadzorem prokuratury - zaznacza Świeży. 
Jak informowaliśmy w piątek, do dramatycznych wydarzeń z udziałem syna Arkadiusza Wojnowskiego, zastępcy komendanta miejskiego policji w Wałbrzychu miało dojść w listopadzie tego roku. W weekend pod klubem na Piaskowej Górze w Wałbrzychu młody mężczyzna miał najpierw uderzyć obywatelkę Litwy, która poprosiła go o ogień i ciosem połamać jej okulary. Policja jednak nie ujawnia czy tak właśnie było, czy też wydarzyło się coś innego.
Z informacji, które do nas dotarły wynika, że kiedy dziewczyna płacząc miała poskarżyć się towarzyszącym jej osobom, między synem komendanta i jego znajomymi miała się wywiązać awantura z towarzyszącymi Litwince wałbrzyszanami. To wtedy miała zostać uderzona druga młoda kobieta. Cios w twarz był na tyle silny, że młodej kobiecie pękła żuchwa w dwóch miejscach, ma mieć również złamaną jedną z kości twarzoczaszki. Korzysta z opieki psychologa. Nie mamy informacji, jakoby syn komendanta wcześniej brał udział w podobnych sytuacjach. 
Zawiadomienie o pobiciu kobiety i spowodowaniu u niej uszczerbku na zdrowiu i poważnych obrażeń ciała miało zostać złożone w wałbrzyskiej prokuraturze. 
Z naszych nieoficjalnych informacji wynika, że zastępca komendanta Arkadiusz Wojnowski odszedł z policji w Wałbrzychu. Miał zostać odwołany ze stanowiska przez komendanta wojewódzkiego, aby zapewnić bezstronność postępowania policji w tej sprawie. Możliwe jednak, że sam zdecydował się odejść ze służby, bo ma pełne prawa emerytalne. Nieoficjalnie wiemy, że rozważał taką możliwość. 
Arkadiusz Wojnowski pełnił nienaganną służbę w policji. Wcześniej pracował w Komendzie Powiatowej Policji w Świdnicy, gdzie był policjantem, referentem, asystentem, specjalistą, dyżurnym, by w 2008 roku zostać zastępcą naczelnika tego wydziału. Był również rzecznikiem prasowym tamtejszej jednostki. Zanim został wicekomendantem w Wałbrzychu, był naczelnikiem Wydziału Prewencji Komendy Miejskiej Policji w Wałbrzychu. W policji służy od 1996 roku. 
Arkadiusz Wojnowski cieszy się sympatią podwładnych i współpracowników, a także dziennikarzy. Policjanci mówią o nim, że jest spokojny, wyważony, pomocny w rozwiązywaniu różnych spraw. Do sprawy wrócimy w poniedziałek, wtedy najprawdopodobniej do tematu odniesie się Komendant Miejski Policji w Wałbrzychu. 
Tutaj mieści się Komenda Miejska Policji w Wałbrzychu, którą pomaga kierować zastępca komendanta Arkadiusz Wojnowski, zobacz na mapie
Czytaj teżDariusz Mikulski, były dyrektor filharmonii w Wałbrzychu został oskarżony i uniewinniony. Opuścił Wałbrzych i robi międzynarodową karierę

Dołącz do nas na Facebooku!
Publikujemy najciekawsze artykuły, wydarzenia i konkursy. Jesteśmy tam gdzie nasi czytelnicy!

Kontakt z redakcją
Byłeś świadkiem ważnego zdarzenia? Widziałeś coś interesującego? Zrobiłeś ciekawe zdjęcie lub wideo?
Żakardowy płaszcz w kwiaty
Sukienka z jedwabiem
Kaszmirowe joggersy
Kaszmirowe joggersy
Dopasowana marynarka z wełną
Marynarka z wiskozy
Parka z kapturem
Szyfonowa sukienka z jedwabiem
Materiał oryginalny: Zastępca komendanta policji w Wałbrzychu odwołany w atmosferze skandalu. Ma to mieć związek z pobiciem kobiety przez jego syna - Wałbrzych Nasze Miasto

Rozpowszechnianie niniejszego artykułu możliwe jest tylko i wyłącznie zgodnie z postanowieniami
„Regulaminu korzystania z artykułów prasowych”i po
wcześniejszym uiszczeniu należności, zgodnie z cennikiem.

Nie hejtuj, pisz kulturalne i zgodne z prawem komentarze! Jeśli widzisz niestosowny wpis - kliknij „zgłoś nadużycie”.
Sprawdź, gdzie znajduje się komenda lub komisariat policji w Bielawie. Z nami dowiesz się, czym się zajmują każdego dnia. Przypomnisz sobie także, kiedy...
Do poważnie wyglądającego zdarzenia drogowego doszło w ubiegły weekend na ul. Świdnickiej w Wałbrzychu. Czołowo zderzyły się tam dwa samochody osobowe. Powód...
W ciągu jednej tylko doby policjanci z Wałbrzycha zatrzymali sześć osób poszukiwanych przez organy ścigania. Siódmej osoby nie zatrzymali... za to odwieźli ją...
Roztrzaskany na latarni samochód, zniszczone znaki drogowe i betonowe słupy wyrwane z jezdni - tak skończyło się dla młodego kierowcy driftowanie na parkingu...
Otrzymaliśmy od Czytelnika szokujące filmiki, na których widać, jak w Głuszycy w powiecie wałbrzyskim grupa ludzi bije łopatami młodego byka. Zwierzę jest...
W piątek (12 maja) na Dolnym Śląsku doszło do śmiertelnego wypadku. Zginął motocyklista z Jawora, który uciekał przed policją. Pościg rozpoczął się już w...
Firmy w mieście
Aktualności
Wiadomości lokalne
Ogłoszenia
Serwisy regionalne
Serwisy partnerskie

Polska Press Sp. z o.o. informuje, że wszystkie treści ukazujące się w serwisie Nasze Miasto
podlegają ochronie.

Jesteś zainteresowany kupnem treści?
Dowiedz się więcej.


© 2000-2023 Polska Press Sp. z o.o.


Wybierz z listy lub przejdź na  

naszemiasto.pl

Nie znaleźliśmy serwisów odpowiadającym twojemu zapytaniu."
5,https://gloswielkopolski.pl/tak-wygladaja-najgrozniejsi-przestepcy-w-polsce-sa-caly-czas-na-wolnosci-zobacz-ich-zdjecia-i-listy-goncze/ar/c1-17175433,"W naszej galerii prezentujemy zdjęcia i nazwiska najgroźniejszych przestępców w Polsce. Są poszukiwani przez policję w związku z zabójstwem, czyli przestępstwem z artykułu 148. kodeksu karnego. Część z nich zabiła swoje ofiary ze szczególnym okrucieństwem. Niektórzy zbezcześcili potem zwłoki. 
Czytaj też: Przerażająca historia domu pod Nowym Tomyślem. Tu brutalnie zamordowano cztery osoby
Wśród poszukiwanych są nie tylko Polacy, ale też Rosjanie, Ukraińcy i obywatel Turcji. Na liście najgroźniejszych przestępców w Polsce są również dwie kobiety.
Kojarzysz twarz któregoś z nich? Wiesz, gdzie mogą przebywać? Koniecznie skontaktuj się z policją. Numery telefonów i adresy mailowe znajdziesz w opisach zdjęć.
Ci przestępcy poszukiwani są m.in. na podstawie KK:
Źródło: policyjna baza poszukiwani.policja.pl.
ZOBACZ TEŻ:Kryminalny Poznań z lat 90. nadal kryje wiele zagadek. Oprócz głośnych, wyjaśnionych zabójstw, były też niewyjaśnione zbrodnie i tajemnicze porwania. Przedstawiamy 10 różnych historii z lat 90., które wydarzyły się w Poznaniu i okolicach. Część zbrodni doczekała się finału w sądzie, ale w niektórych sprawach do dzisiaj nie ustalono, co stało się z ciałami zamordowanych osób lub wyjaśniono tylko niektóre wątki.

Głośne zabójstwa, niewyjaśnione zbrodnie i tajemnicze znikni...


Dołącz do nas na Facebooku!
Publikujemy najciekawsze artykuły, wydarzenia i konkursy. Jesteśmy tam gdzie nasi czytelnicy!

Dołącz do nas na Twitterze!
Codziennie informujemy o ciekawostkach i aktualnych wydarzeniach.

Kontakt z redakcją
Byłeś świadkiem ważnego zdarzenia? Widziałeś coś interesującego? Zrobiłeś ciekawe zdjęcie lub wideo?
Żakardowy płaszcz w kwiaty
Sukienka z jedwabiem
Kaszmirowe joggersy
Kaszmirowe joggersy
Dopasowana marynarka z wełną
Marynarka z wiskozy
Parka z kapturem
Szyfonowa sukienka z jedwabiem

Rozpowszechnianie niniejszego artykułu możliwe jest tylko i wyłącznie zgodnie z postanowieniami
„Regulaminu korzystania z artykułów prasowych”i po
wcześniejszym uiszczeniu należności, zgodnie z cennikiem.

Nie hejtuj, pisz kulturalne i zgodne z prawem komentarze! Jeśli widzisz niestosowny wpis - kliknij „zgłoś nadużycie”.
W całym Poznaniu nie brakuje sklepów z odzieżą używaną. Choć ich wybór jest duży, to niektóre punkty cieszą się większą popularnością od innych. Duży wybór...
Agnieszka Włodarczyk od dłuższego czasu jest w związku ze znanym sportowcem, a w tym roku ogłosiła, że weźmie z nim ślub. Kim jest partner aktorki? To młodszy o...
Wodospady są jednymi z najbardziej hipnotyzujących atrakcji turystycznych na całym świecie. Spadająca z wysokości woda tworzy wspaniałe widowisko dla turystów i...
Viki Gabor to znana wokalistka młodego pokolenia. Choć ma dopiero 15 lat, już robi zawrotną karierę zarówno w Polsce, jak i na świecie. Uwagę skrada nie tylko...
Policjanci z KWP w Poznaniu zatrzymali 36-latka podejrzanego o liczne oszustwa internetowe. Używając nicku „vendisto” mógł oszukać około 100 osób z całej...
Co na komary? 10 sposobów, które ochronią Cię przed komarami. Komary - te krwiożercze upiory, przychodzą na świat tylko po to, aby namieszać w naszym spokojnym...
Tematy na czasie
Aktualności
Wiadomości lokalne
Ogłoszenia
Serwisy regionalne
Serwisy partnerskie

Polska Press Sp. z o.o. informuje, że wszystkie treści ukazujące się w serwisie Głos Wielkopolski
podlegają ochronie.

Jesteś zainteresowany kupnem treści?
Dowiedz się więcej.


© 2000-2023 Polska Press Sp. z o.o.
"
