,url,text
14,https://slubice.naszemiasto.pl/takie-sposoby-na-obserwowanie-mieszkan-maja-wlamywacze/ar/c9-8954785,"Zobacz wideo: Bydgoscy ""wywiadowcy"" w służbie:
Niedawno na swoim profilu na Instagramie podinspektor Małgorzata Sokołowska opublikowała post, w którym zamieściła zdjęcie kartki z ostrzeżeniem przed włamywaczami. Post opatrzyła opisem: ""Czasami śmiejemy się z „żywego monitoringu sąsiedzkiego” czyli sąsiadek, które na emeryturze stoją w oknie i bacznie wszystko obserwują. Totalnie niesłusznie, bo to te osoby są lepszym zabezpieczeniem prewencyjnym przed złodziejami niż nowoczesne kamery. Zwłaszcza w okresie wakacyjnych wyjazdów. Doceniajmy relacje sąsiedzkie i bacznie obserwujmy swoje najbliższe otoczenie, a o wszelkich niestandardowych zmianach niezwłocznie informujmy sąsiadów"".
W ""sąsiedzkim"" ostrzeżeniu możemy przeczytać m.in. o tym, że złodzieje oznaczają mieszkania, które obserwują, malując przy drzwiach kółka. Jak jeszcze działają włamywacze? Sprawdź w galerii sposoby ich działania. 
Malowanie kółek czy kropek przy drzwiach wejściowych to nie jedyne metody, jakimi posługują się włamywacze i złodzieje. Zobacz, na co jeszcze trzeba zwracać uwagę, bo tak mogą działać włamywacze:

Dołącz do nas na Facebooku!
Publikujemy najciekawsze artykuły, wydarzenia i konkursy. Jesteśmy tam gdzie nasi czytelnicy!

Kontakt z redakcją
Byłeś świadkiem ważnego zdarzenia? Widziałeś coś interesującego? Zrobiłeś ciekawe zdjęcie lub wideo?
Odkryj jak Twój organizm, umysł i samopoczucie zmi...
Zastanawiasz się od czego zacząć zmianę sposobu od...
Gotowi na śmiały krok w kierunku zdrowia? Ten wari...
Prowadzisz aktywny tryb życia? Lubisz wyzwania? Po...
Chcesz dobrze wyglądać i czuć się świetnie? Profes...
Uprawiasz trening siłowy i chcesz zbudować ponadpr...
Trenujesz bieganie, pływasz, jeździsz na rowerze l...
Materiał oryginalny: Takie sposoby na obserwowanie mieszkań mają włamywacze. Policja ostrzega, zwróć na to uwagę - Express Bydgoski

Rozpowszechnianie niniejszego artykułu możliwe jest tylko i wyłącznie zgodnie z postanowieniami
„Regulaminu korzystania z artykułów prasowych”i po
wcześniejszym uiszczeniu należności, zgodnie z cennikiem.

Nie hejtuj, pisz kulturalne i zgodne z prawem komentarze! Jeśli widzisz niestosowny wpis - kliknij „zgłoś nadużycie”.
Kayah kocha podróże i poznawanie nowych zakątków świata. Polska gwiazda piosenki od czasu do czasu inwestuje zarobione pieniądze w nieruchomości. Jakiś czas...
Marzysz o nowej kuchni, a nie masz funduszy na generalny remont i wymianę mebli na nowe? Jest na to sposób. Wystarczy pomalować fronty i kupić modne uchwyty do...
„Dzikie eksmisje” to problem, który istnieje od lat. Choć zgodnej z prawem eksmisji może dokonać tylko komornik, niektórzy właściciele mieszkań na wynajem...
Każdy może stać się ofiarą koszmarnych bubli budowlanych. Wystarczy, że trafimy na nieodpowiednich majstrów, a nasz remont zamieni się w totalną katastrofę....
Kwiaty, które są miododajne, czyli pożyteczne dla pszczół, mogą być wspaniałą ozdobą ogrodu. Najczęściej są kolorowe i niezbyt wymagające. Warto je dobrać tak,...
Zioła pozytywnie wpływają nie tylko na zdrowie ludzi, ale też roślin, w tym warzyw. Niektóre mogą pomóc odstraszyć szkodniki, ograniczyć choroby grzybowe, a...
Firmy w mieście
Aktualności
Wiadomości lokalne
Ogłoszenia
Serwisy regionalne
Serwisy partnerskie

Polska Press Sp. z o.o. informuje, że wszystkie treści ukazujące się w serwisie Nasze Miasto
podlegają ochronie.

Jesteś zainteresowany kupnem treści?
Dowiedz się więcej.


© 2000-2023 Polska Press Sp. z o.o.


Wybierz z listy lub przejdź na  

naszemiasto.pl

Nie znaleźliśmy serwisów odpowiadającym twojemu zapytaniu."
15,https://gloswielkopolski.pl/tak-wygladaja-najgrozniejsi-przestepcy-w-polsce-sa-caly-czas-na-wolnosci-zobacz-ich-zdjecia-i-listy-goncze/ar/c1-17175433,"W naszej galerii prezentujemy zdjęcia i nazwiska najgroźniejszych przestępców w Polsce. Są poszukiwani przez policję w związku z zabójstwem, czyli przestępstwem z artykułu 148. kodeksu karnego. Część z nich zabiła swoje ofiary ze szczególnym okrucieństwem. Niektórzy zbezcześcili potem zwłoki. 
Czytaj też: Przerażająca historia domu pod Nowym Tomyślem. Tu brutalnie zamordowano cztery osoby
Wśród poszukiwanych są nie tylko Polacy, ale też Rosjanie, Ukraińcy i obywatel Turcji. Na liście najgroźniejszych przestępców w Polsce są również dwie kobiety.
Kojarzysz twarz któregoś z nich? Wiesz, gdzie mogą przebywać? Koniecznie skontaktuj się z policją. Numery telefonów i adresy mailowe znajdziesz w opisach zdjęć.
Ci przestępcy poszukiwani są m.in. na podstawie KK:
Źródło: policyjna baza poszukiwani.policja.pl.
ZOBACZ TEŻ:Kryminalny Poznań z lat 90. nadal kryje wiele zagadek. Oprócz głośnych, wyjaśnionych zabójstw, były też niewyjaśnione zbrodnie i tajemnicze porwania. Przedstawiamy 10 różnych historii z lat 90., które wydarzyły się w Poznaniu i okolicach. Część zbrodni doczekała się finału w sądzie, ale w niektórych sprawach do dzisiaj nie ustalono, co stało się z ciałami zamordowanych osób lub wyjaśniono tylko niektóre wątki.

Głośne zabójstwa, niewyjaśnione zbrodnie i tajemnicze znikni...


Dołącz do nas na Facebooku!
Publikujemy najciekawsze artykuły, wydarzenia i konkursy. Jesteśmy tam gdzie nasi czytelnicy!

Dołącz do nas na Twitterze!
Codziennie informujemy o ciekawostkach i aktualnych wydarzeniach.

Kontakt z redakcją
Byłeś świadkiem ważnego zdarzenia? Widziałeś coś interesującego? Zrobiłeś ciekawe zdjęcie lub wideo?
Żakardowy płaszcz w kwiaty
Sukienka z jedwabiem
Kaszmirowe joggersy
Kaszmirowe joggersy
Dopasowana marynarka z wełną
Marynarka z wiskozy
Parka z kapturem
Szyfonowa sukienka z jedwabiem

Rozpowszechnianie niniejszego artykułu możliwe jest tylko i wyłącznie zgodnie z postanowieniami
„Regulaminu korzystania z artykułów prasowych”i po
wcześniejszym uiszczeniu należności, zgodnie z cennikiem.

Nie hejtuj, pisz kulturalne i zgodne z prawem komentarze! Jeśli widzisz niestosowny wpis - kliknij „zgłoś nadużycie”.
W całym Poznaniu nie brakuje sklepów z odzieżą używaną. Choć ich wybór jest duży, to niektóre punkty cieszą się większą popularnością od innych. Duży wybór...
Agnieszka Włodarczyk od dłuższego czasu jest w związku ze znanym sportowcem, a w tym roku ogłosiła, że weźmie z nim ślub. Kim jest partner aktorki? To młodszy o...
Wodospady są jednymi z najbardziej hipnotyzujących atrakcji turystycznych na całym świecie. Spadająca z wysokości woda tworzy wspaniałe widowisko dla turystów i...
Viki Gabor to znana wokalistka młodego pokolenia. Choć ma dopiero 15 lat, już robi zawrotną karierę zarówno w Polsce, jak i na świecie. Uwagę skrada nie tylko...
Policjanci z KWP w Poznaniu zatrzymali 36-latka podejrzanego o liczne oszustwa internetowe. Używając nicku „vendisto” mógł oszukać około 100 osób z całej...
Co na komary? 10 sposobów, które ochronią Cię przed komarami. Komary - te krwiożercze upiory, przychodzą na świat tylko po to, aby namieszać w naszym spokojnym...
Tematy na czasie
Aktualności
Wiadomości lokalne
Ogłoszenia
Serwisy regionalne
Serwisy partnerskie

Polska Press Sp. z o.o. informuje, że wszystkie treści ukazujące się w serwisie Głos Wielkopolski
podlegają ochronie.

Jesteś zainteresowany kupnem treści?
Dowiedz się więcej.


© 2000-2023 Polska Press Sp. z o.o.
"
16,https://katowice.naszemiasto.pl/obywatel-niemiec-okradl-uczestnika-swiatowego-forum/ar/c1-8887109,"Katowiccy policjanci zatrzymali 37-letniego obywatela Niemiec, który w jednym z hoteli okradł uczestnika Światowego Forum Miejskiego. Trzydziestopięcioletni obywatel Angoli zorientował się rankiem, że w pokoju nie ma jego saszetki, w której trzymał dokumenty, karty bankomatowe i klucze do samochodu. Łączną wartość skradzionych przedmiotów oszacowano na około 1000 złotych. Uczestnik WUF 11 powiadomił o sprawie policję, która szybko ujęła sprawcę przestępstwa.
Okazał się nim przebywający w tym samym co pokrzywdzony hotelu obywatel Niemiec. Mężczyzna wykorzystał sytuację, że drzwi do pokoju pokrzywdzonego nie były zamknięte na klucz. Wszedł do pokoju i ukradł saszetkę z rzeczami osobistymi Angolczyka.
Wszystkie skradzione przedmioty udało się odzyskać. Sprawca został ujęty i doprowadzony do katowickiej komendy, gdzie złożył wyjaśnienia i przyznał się do winy. Wyraził chęć dobrowolnego poddania się karze 6 miesięcy pozbawienia wolności w zawieszeniu na 2 lata i zapłaty 4 tysięcy złotych grzywny. O jego dalszym losie i wymiarze kary zadecyduje teraz sąd. Za kradzież grozi mu kara do 5 lat pozbawienia wolności. 

Dołącz do nas na Facebooku!
Publikujemy najciekawsze artykuły, wydarzenia i konkursy. Jesteśmy tam gdzie nasi czytelnicy!

Kontakt z redakcją
Byłeś świadkiem ważnego zdarzenia? Widziałeś coś interesującego? Zrobiłeś ciekawe zdjęcie lub wideo?
Żakardowy płaszcz w kwiaty
Sukienka z jedwabiem
Kaszmirowe joggersy
Kaszmirowe joggersy
Dopasowana marynarka z wełną
Marynarka z wiskozy
Parka z kapturem
Szyfonowa sukienka z jedwabiem

Rozpowszechnianie niniejszego artykułu możliwe jest tylko i wyłącznie zgodnie z postanowieniami
„Regulaminu korzystania z artykułów prasowych”i po
wcześniejszym uiszczeniu należności, zgodnie z cennikiem.

Nie hejtuj, pisz kulturalne i zgodne z prawem komentarze! Jeśli widzisz niestosowny wpis - kliknij „zgłoś nadużycie”.
Funkcjonariusze z oddziału prewencji policji w Katowicach schwytali mężczyznę, który próbował oszukać kobietę z Katowic, podszywając się pod policjanta....
Do niecodziennej sytuacji doszło w środę 12 kwietnia w Katowicach. Funkcjonariusze katowickiej prewencji przy ulicy Warszawskiej zatrzymali do kontroli osobowe...
Kompletnie pijany 27-latek awanturował się na dworcu PKP, spożywał alkohol, a po zatrzymaniu znieważał funkcjonariuszy policji. W pewnym momencie, aby uniknąć...
Kryminalni z komisariatu III katowickiej policji przechwycili sporą ilość nielegalnego towaru bez polskich znaków akcyzy. Towary znaleziono podczas kontroli w...
ŚLĄSK. Policjanci zlikwidowali plantację marihuany, która znajdowała się w jednym z mieszkań w centrum Katowic. Domowa plantacja należała do 31-latka. Mundurowi...
19-letni mieszkaniec jednego z katowickich osiedli ostrzelał z pistoletu na śrut blok mieszkalny i samochód. Do zdarzenia doszło tydzień temu, w nocy z 12 na 13...
Firmy w mieście
Aktualności
Wiadomości lokalne
Ogłoszenia
Serwisy regionalne
Serwisy partnerskie

Polska Press Sp. z o.o. informuje, że wszystkie treści ukazujące się w serwisie Nasze Miasto
podlegają ochronie.

Jesteś zainteresowany kupnem treści?
Dowiedz się więcej.


© 2000-2023 Polska Press Sp. z o.o.


Wybierz z listy lub przejdź na  

naszemiasto.pl

Nie znaleźliśmy serwisów odpowiadającym twojemu zapytaniu."
17,https://bielawa.naszemiasto.pl/damski-bokser-na-drodze-furiat-pobil-kobiete-policjantke-po/ar/c1-9270069,"Do zdarzenia doszło po południu, w piątek (24 marca) w Nowej Rudzie. Kierujący samochodem 23-letni mieszkaniec powiatu kłodzkiego, prowadził samochód w sposób niezgodny z przepisami. Gdy nagle się zatrzymał, jadąca za nim kobieta wyszła mu pomóc. Okazało się, że to policjantka po służbie.
- Mężczyzna zachowywał się agresywnie, co wzbudziło podejrzenia funkcjonariuszki. Kobieta poinformowała, że jest policjantką i podjęła próbę wyciągnięcia kluczyków ze stacyjki. Po tym doszło do szarpaniny i agresor uderzył funkcjonariuszkę, a następnie uciekł z miejsca zdarzenia. Wstępnie obrażenia policjantki zostały zakwalifikowane jako naruszające czynności ciała powyżej siedmiu dni – mówi prok. Maciej Leszczyński z prokuratury rejonowej w Kłodzku.
Budowa tego znanego, podwrocławskiego zalewu rozpoczęła się w połowie lat 70. XX wieku. Napełniono go wodą dopiero 12 lat później, w 1986 roku. Rok później rozpoczęło się wydobycie kruszyw naturalnych…
Zobacz atak na policjantkę:
źródło: YouTube / Kłodzko24
Po dwóch godzinach policja zatrzymała sprawcę pobicia policjantki. Podczas zatrzymania przy 23-letnim mężczyźnie zostały znalezione narkotyki. Obecnie kierowca przebywa w areszcie. Zostały mu przedstawione, aż cztery zarzuty:
Za wszystkie zarzuty kierującemu samochodem 23-latkowi może grozić nawet do 20 lat – dodaje prok. Leszczyński.
Sprzątanie miejsc zbrodni i śmierci nie należy do najłatwiejszych zawodów. A właśnie tym trudni się Robert Krzywicki z Legnicy, który prowadzi nietypową firmę Crime Service, jedyną taką na Dolnym…

Dołącz do nas na Facebooku!
Publikujemy najciekawsze artykuły, wydarzenia i konkursy. Jesteśmy tam gdzie nasi czytelnicy!

Kontakt z redakcją
Byłeś świadkiem ważnego zdarzenia? Widziałeś coś interesującego? Zrobiłeś ciekawe zdjęcie lub wideo?
Żakardowy płaszcz w kwiaty
Sukienka z jedwabiem
Kaszmirowe joggersy
Kaszmirowe joggersy
Dopasowana marynarka z wełną
Marynarka z wiskozy
Parka z kapturem
Szyfonowa sukienka z jedwabiem
Materiał oryginalny: Damski bokser na drodze! Furiat pobił kobietę, policjantkę po służbie. Grozi mu 20 lat więzienia [FILM] - Gazeta Wrocławska

Rozpowszechnianie niniejszego artykułu możliwe jest tylko i wyłącznie zgodnie z postanowieniami
„Regulaminu korzystania z artykułów prasowych”i po
wcześniejszym uiszczeniu należności, zgodnie z cennikiem.

Nie hejtuj, pisz kulturalne i zgodne z prawem komentarze! Jeśli widzisz niestosowny wpis - kliknij „zgłoś nadużycie”.
Roztrzaskany na latarni samochód, zniszczone znaki drogowe i betonowe słupy wyrwane z jezdni - tak skończyło się dla młodego kierowcy driftowanie na parkingu...
Wielu kierowców decyduje się kierować pojazdem po spożyciu alkoholu. Często w takich sytuacjach dochodzi do tzw. obywatelskiego zatrzymania. Jak zrobić to...
W piątek (12 maja) na Dolnym Śląsku doszło do śmiertelnego wypadku. Zginął motocyklista z Jawora, który uciekał przed policją. Pościg rozpoczął się już w...
W mediach społecznościowych pojawiło się nagranie kierowcy, który na ul. Lwowskiej w Legnicy potrącił 8-letniego chłopca. Autor nagrania jechał przepisowo....
W ostatnich dniach wiele mówi się o zmianach w prawie, które mają spowodować, że kierowca będzie szybcej miał kasowane punkty karne. Okazuje się, że projekt...
Poważny wypadek na drodze numer 395 między Wrocławiem a Strzelinem w miejscowości Polakowice. Samochód osobowy, w którym podróżowały dwie osoby dorosłe i...
Firmy w mieście
Aktualności
Wiadomości lokalne
Ogłoszenia
Serwisy regionalne
Serwisy partnerskie

Polska Press Sp. z o.o. informuje, że wszystkie treści ukazujące się w serwisie Nasze Miasto
podlegają ochronie.

Jesteś zainteresowany kupnem treści?
Dowiedz się więcej.


© 2000-2023 Polska Press Sp. z o.o.


Wybierz z listy lub przejdź na  

naszemiasto.pl

Nie znaleźliśmy serwisów odpowiadającym twojemu zapytaniu."
18,https://nowasol.naszemiasto.pl/po-strzelaninie-w-stalowej-woli-prokuratura-skierowala-do/ar/c1-8731943,"Podkarpacki Wydział Zamiejscowy Departamentu do Spraw Przestępczości Zorganizowanej i Korupcji Prokuratury Krajowej w Rzeszowie oskarżył Filipa S. o usiłowanie zabójstwa oraz udział w bójce z użyciem broni palnej, której następstwem był ciężki uszczerbek na zdrowiu. Czyny te zagrożone są karą nawet dożywotniego pozbawienia wolności.
Kolejnym oskarżonym, w tym Markowi S. Filipowi S., Konradowi R., Danielowi W., Łukaszowi S., prokurator zarzucił udział w bójce z użyciem broni palnej i innych niebezpiecznych przedmiotów, której następstwem był ciężki uszczerbek na zdrowiu. Czyny te zagrożone są karą do 8 lat pozbawienia wolności. Natomiast Radosławowi R. prokurator zarzucił utrudnienie postępowania karnego poprzez ukrycie pistoletu, z którego strzelał jeden z oskarżonych. Czyn ten zagrożony jest karą do 5 lat więzienia.
Do konfrontacji dwóch wrogo nastawionych do siebie grup doszło 26 października 2020 roku w godzinach wieczornych w Stalowej Woli, w pobliżu bloku mieszkalnego przy ulicy Energetyków. Do pierwszej grupy należeli Marek S. i jego syn Filip S. działający ze sobą wspólnie i w porozumieniu, używający niebezpiecznych narzędzi w postaci broni palnej oraz psa rasy amstaff zaliczanego do kategorii niebezpiecznych. Do drugiej grupy należeli Konrad R., Daniel W. i Łukasz S., działający ze sobą wspólnie i w porozumieniu, używający niebezpiecznych narzędzi w postaci rewolweru czarnoprochowego, siekiery, maczety oraz miotacza gazu obezwładniającego.
Podczas zdarzenia oskarżony Filip S. poprzez oddanie kilku strzałów z broni palnej usiłował pozbawić życia Daniela W., powodując u niego obrażenia ciała, skutkujące ciężkim uszczerbkiem na zdrowiu, narażającym go na bezpośrednie niebezpieczeństwo utraty życia. Ponadto w czasie bójki oskarżony Konrad R. doznał rany postrzałowej na skutek użycia rewolweru czarnoprochowego, które to obrażenia naruszyły czynności narządów jego ciała na okres powyżej 7 dni, narażając go w ten sposób na utratę życia i zdrowia. Po zdarzeniu Radosław R. zacierał ślady zdarzenia i ukrył pistolet, z którego strzelał Filip S., przez co utrudnił prowadzenie postępowania karnego.

Dołącz do nas na Facebooku!
Publikujemy najciekawsze artykuły, wydarzenia i konkursy. Jesteśmy tam gdzie nasi czytelnicy!

Kontakt z redakcją
Byłeś świadkiem ważnego zdarzenia? Widziałeś coś interesującego? Zrobiłeś ciekawe zdjęcie lub wideo?
Żakardowy płaszcz w kwiaty
Sukienka z jedwabiem
Kaszmirowe joggersy
Kaszmirowe joggersy
Dopasowana marynarka z wełną
Marynarka z wiskozy
Parka z kapturem
Szyfonowa sukienka z jedwabiem
Materiał oryginalny: Po strzelaninie w Stalowej Woli. Prokuratura skierowała do sądu akt oskarżenia, sześciu mężczyzn z zarzutami - Portal i.pl

Rozpowszechnianie niniejszego artykułu możliwe jest tylko i wyłącznie zgodnie z postanowieniami
„Regulaminu korzystania z artykułów prasowych”i po
wcześniejszym uiszczeniu należności, zgodnie z cennikiem.

Nie hejtuj, pisz kulturalne i zgodne z prawem komentarze! Jeśli widzisz niestosowny wpis - kliknij „zgłoś nadużycie”.
Pod jednym z bloków na ulicy Piastów w Krośnie Odrzańskim, we wtorek (20 grudnia) w godzinach wieczornych, doszło do szarpaniny dwóch obywateli Ukrainy. Jeden z...
Zapadły wyroki w głośnej sprawie „ganku Maski”, który napadał na banki. Gangsterzy w sumie zrabowali ponad 250 tysięcy zł. Pieniędzy nigdy nie udało się...
Adrian H. i Remigiusz K. skazani za porwanie i torturowanie Mariusza S. w jednym z nowosolskich mieszkań. Obaj spędzą za kratami po 6,5 roku więzienia. Obrońca...
Sceny, które rozegrały się w centrum Słubic, mroziły krew w żyłach. W poniedziałek, 6 listopada, dwóch mężczyzn siłą wrzuciło do samochodu 25-letnią kobietę....
Prokurator Rejonowy w Nowej Soli skierował do sądu akt oskarżenia przeciwko 38-letniemu mężczyźnie, który...
Prokurator Rejonowy w Nowej Soli skierował do sądu akt oskarżenia wobec 50-letniego mężczyzny, któremu zarzucono, że 26 maja br. w Stypułowie z wiatrówki...
Firmy w mieście
Aktualności
Wiadomości lokalne
Ogłoszenia
Serwisy regionalne
Serwisy partnerskie

Polska Press Sp. z o.o. informuje, że wszystkie treści ukazujące się w serwisie Nasze Miasto
podlegają ochronie.

Jesteś zainteresowany kupnem treści?
Dowiedz się więcej.


© 2000-2023 Polska Press Sp. z o.o.


Wybierz z listy lub przejdź na  

naszemiasto.pl

Nie znaleźliśmy serwisów odpowiadającym twojemu zapytaniu."
